{
  "id": "H-SRC-pc",
  "category": "source",
  "subject": "pc",
  "statement": "Desktop computer is an excitation source",
  "level": "supported",
  "supporting": [
    "ev-se-0001"
  ],
  "contradicting": [],
  "missing_tests": [
    "equipment_state:pc"
  ],
  "rules": [
    "R-SRC-001@1"
  ],
  "explanation": [
    "Switching it off changed the problem in 1 experiment"
  ]
}
